{"id":"0VY3GwZk4OmV006","contextName":"example-service","aggregateName":"cart","header":{"command_operator":"customer-1","trace_id":"0VY3GwZi4OmV005","upstream_id":"0VY3GwZi4OmV005","upstream_name":"add_cart_item"},"aggregateId":"0VY3GwKq4OmV001","tenantId":"(0)","ownerId":"customer-1","spaceId":"","commandId":"0VY3GwZi4OmV005","requestId":"0VY3GwZi4OmV005","version":2,"body":[{"id":"0VY3GwZk4OmV007","name":"cart_item_added","revision":"0.0.1","bodyType":"me.ahoo.wow.example.api.cart.CartItemAdded","body":{"added":{"productId":"product-2","quantity":3}}}],"createTime":1792004186816}